{
  "runtime_selector_version": "0.3",
  "runtime_family": "llama.cpp",
  "platform": {
    "system": "macos",
    "arch": "aarch64",
    "version": "14.6"
  },
  "accelerator": {
    "vendor": "apple",
    "api": "metal",
    "model": "Apple M4 Max",
    "vram_bytes": null,
    "compute_capability": null
  },
  "delivery": {
    "mode": "managed_download",
    "binary_set": "llama_cpp_macos_metal_aarch64",
    "source": "infergrade_runtime_manifest",
    "selected_by": "managed_recommendation"
  },
  "binary": {
    "path": null,
    "version_output": "llama.cpp build 0.2.21-preview",
    "checksum_verified": true,
    "signature_verified": false
  },
  "compatibility": {
    "status": "ready",
    "reason_codes": [],
    "probes": [
      {
        "id": "binary_version_smoke",
        "status": "passed",
        "observed": "llama.cpp build 0.2.21-preview"
      }
    ]
  },
  "support": {
    "tier": "reference",
    "claim_boundary": "Apple Silicon Metal managed runtime path validated for private beta local GGUF runs."
  },
  "fallback": {
    "allowed": false,
    "mode": null,
    "reason": "Do not silently change accelerator API for an evidence-producing run."
  }
}
